{
  "$schema": "https://schemas.globalgovernanceframeworks.org/irf/1.0/institutional-regeneration-v1.0-specification.schema.json",
  "framework_id": "IRF/1.0",
  "title": "Institutional Regeneration Framework",
  "version": "1.0",
  "date": "2026-08-06",
  "status": "document_and_machine_compatible",
  "legal_character": "Voluntary advisory and implementation-support framework; not a source of charter authority, member-state consent, employment power, funding entitlement, adjudication, emergency command, programme closure, or institutional dissolution.",
  "source_lineage": {
    "CIS/0.2.1": {
      "filename": "constitutional-interface-specification-v0.2.1.md",
      "sha256": "2ab06be70d568be82efde2ccbcc3f8df48f37308fab3ccf116ac3efe4c167bfc",
      "bytes": 81323
    },
    "GMEAIA/0.2.1": {
      "filename": "governance-method-experiment-adoption-implementation-authority-interface-specification-v0.2.1.md",
      "sha256": "8cdaf8c316b50b251721a824124e47b1ad30787e9f5281d7fade0f4360bfe5d1",
      "bytes": 90094
    },
    "META-GOVERNANCE/1.6": {
      "filename": "integrated-meta-governance-v1.6.md",
      "sha256": "cf1cd81a681b6b94ef4107cee35dfdabb3a991f6472c75d87fa7218a229466ba",
      "bytes": 87518
    },
    "NESTED-ECONOMIES/3.3": {
      "filename": "nested-economies-v3.3.md",
      "sha256": "aae656d32f8b45ebf228e6f387d8e461d8767f238219911b8911c2ef95f00b59",
      "bytes": 92594
    },
    "IRF/1.0": {
      "filename": "institutional-regeneration-v1.0.md",
      "sha256": "75b3b9ad28f4b4135ac4df90aa1f1c12c1cce0d04ed0418959a82eb27e8847e9",
      "bytes": 83024
    }
  },
  "constitutional_interface": "CIS/0.2.1",
  "controlling_interface": "GMEAIA/0.2.1",
  "event_transport": "EGP/1.2",
  "implementation_companion": "IAF/1.2",
  "tool_commons": "IMT/0.9",
  "deliberation_companion": "WDIP/1.7",
  "coordination_interface": "META-GOVERNANCE/1.6",
  "economic_coordination_companion": "NESTED-ECONOMIES/3.3",
  "non_authority_clause": "Audit is not jurisdiction. Participation is not consent. A reform proposal is not charter change. A completed workshop is not regeneration. A successful pilot is not permission to scale. Conformance is not legitimacy or success.",
  "action_class_assignment_basis": "Primary action classes are implementation mappings derived from §4 domains and each record title and purpose; they do not narrow secondary functions or GMEAIA crosswalks.",
  "action_classes": [
    {
      "id": "A",
      "scope": "Constitution and mandate"
    },
    {
      "id": "B",
      "scope": "Affected parties and representation"
    },
    {
      "id": "C",
      "scope": "Audit and diagnosis"
    },
    {
      "id": "D",
      "scope": "Evolution Cells and internal reform"
    },
    {
      "id": "E",
      "scope": "Governance and charter change"
    },
    {
      "id": "F",
      "scope": "Culture and personnel"
    },
    {
      "id": "G",
      "scope": "Funding and budgeting"
    },
    {
      "id": "H",
      "scope": "Pilot authorization and activation"
    },
    {
      "id": "I",
      "scope": "Audit, metrics, and AI"
    },
    {
      "id": "J",
      "scope": "Learning and public narrative"
    },
    {
      "id": "K",
      "scope": "Transition and dissolution"
    },
    {
      "id": "L",
      "scope": "Records, remedies, and closure"
    },
    {
      "id": "M",
      "scope": "Emergency and coercive handoffs"
    },
    {
      "id": "N",
      "scope": "Data, access, and privacy"
    },
    {
      "id": "O",
      "scope": "Partnerships and vendors"
    },
    {
      "id": "P",
      "scope": "Labour and beneficiary protection"
    }
  ],
  "reform_classes": [
    {
      "id": "symptom",
      "definition": "changes current behavior while the main selection pressures remain;"
    },
    {
      "id": "capacity",
      "definition": "improves resources, skills, infrastructure, or operational ability under the current mandate;"
    },
    {
      "id": "incentive",
      "definition": "changes rewards, penalties, funding, promotion, appointment, exposure, or accountability;"
    },
    {
      "id": "authority",
      "definition": "changes who may decide, block, inspect, fund, or compel;"
    },
    {
      "id": "reproductive",
      "definition": "changes the conditions that cause the institution's characteristic behavior to return after leadership, policy, or pilot changes."
    }
  ],
  "adoption_states": [
    "exploratory",
    "advisory_use",
    "voluntary_internal_pilot",
    "contractually_supported",
    "charter_change_proposed",
    "lawfully_amended",
    "transition_proposed",
    "transition_authorized",
    "closing",
    "closed_with_unresolved_duties",
    "closed"
  ],
  "evidence_access_states": [
    "available",
    "legally protected",
    "operationally inaccessible",
    "refused by a named authority",
    "destroyed or missing",
    "disputed",
    "outside jurisdiction."
  ],
  "consequence_profiles": [
    {
      "id": "CP0",
      "name": "Exploratory and non-consequential",
      "examples": "public education, optional brainstorming, non-operative drafting, simulation, or demonstration.",
      "core": "one compact non-operative record identifying the method or artifact, responsible actor, authority effect, and non-activation status. Data and closure semantics are added where material."
    },
    {
      "id": "CP1",
      "name": "Voluntary bounded practice",
      "examples": null,
      "core": "actor and method; voluntary scope; consent, refusal, and withdrawal; implementation responsibility; stop and expiry; complaint and correction route."
    },
    {
      "id": "CP2",
      "name": "Operational or consequential action",
      "examples": null,
      "core": "constituting authority; affected parties; causal responsibility; authorization and activation; implementation ownership and dependencies; monitoring and review; challenge and remedy; closure and unresolved-duty custody."
    },
    {
      "id": "CP3",
      "name": "Protected-domain or constitutional action",
      "examples": null,
      "core": "`CP2` plus `GMEAIA-56` or `GMEAIA-57` and the controlling specialized interface. Ordinary GMEAIA conformance is never sufficient by itself."
    }
  ],
  "handoff_states": [
    "offered",
    "acknowledged",
    "accepted",
    "partially_accepted",
    "capacity_limited",
    "refused",
    "deferred",
    "referred",
    "timed_out",
    "misrouted",
    "constitutional_gap",
    "returned",
    "closed"
  ],
  "authority_formation_states": [
    "retained",
    "delegated",
    "transferred",
    "concurrent",
    "jointly_constituted",
    "absent"
  ],
  "response_duty_effects": [
    "legal",
    "contractual",
    "charter_internal",
    "voluntary_commitment",
    "advisory",
    "none"
  ],
  "common_header_fields": [
    {
      "number": 1,
      "field": "record_id"
    },
    {
      "number": 2,
      "field": "record_type"
    },
    {
      "number": 3,
      "field": "schema_version"
    },
    {
      "number": 4,
      "field": "created_at"
    },
    {
      "number": 5,
      "field": "effective_at"
    },
    {
      "number": 6,
      "field": "expires_at"
    },
    {
      "number": 7,
      "field": "status"
    },
    {
      "number": 8,
      "field": "normative_force"
    },
    {
      "number": 9,
      "field": "authority_effect"
    },
    {
      "number": 10,
      "field": "action_class"
    },
    {
      "number": 11,
      "field": "source_framework_id"
    },
    {
      "number": 12,
      "field": "source_framework_version"
    },
    {
      "number": 13,
      "field": "source_record_ids"
    },
    {
      "number": 14,
      "field": "supersedes"
    },
    {
      "number": 15,
      "field": "superseded_by"
    },
    {
      "number": 16,
      "field": "actor_id"
    },
    {
      "number": 17,
      "field": "actor_type"
    },
    {
      "number": 18,
      "field": "office_or_role"
    },
    {
      "number": 19,
      "field": "representation_source"
    },
    {
      "number": 20,
      "field": "technical_credential_refs"
    },
    {
      "number": 21,
      "field": "constituting_instrument"
    },
    {
      "number": 22,
      "field": "legal_power"
    },
    {
      "number": 23,
      "field": "jurisdiction_territorial"
    },
    {
      "number": 24,
      "field": "jurisdiction_personal"
    },
    {
      "number": 25,
      "field": "jurisdiction_subject_matter"
    },
    {
      "number": 26,
      "field": "jurisdiction_temporal"
    },
    {
      "number": 27,
      "field": "affected_party_refs"
    },
    {
      "number": 28,
      "field": "affected_indigenous_nation_refs"
    },
    {
      "number": 29,
      "field": "protected_domain_flags"
    },
    {
      "number": 30,
      "field": "consent_record_refs"
    },
    {
      "number": 31,
      "field": "authority_record_refs"
    },
    {
      "number": 32,
      "field": "activation_record_refs"
    },
    {
      "number": 33,
      "field": "access_class"
    },
    {
      "number": 34,
      "field": "public_summary"
    },
    {
      "number": 35,
      "field": "protected_annex_refs"
    },
    {
      "number": 36,
      "field": "data_purpose"
    },
    {
      "number": 37,
      "field": "retention_rule"
    },
    {
      "number": 38,
      "field": "correction_status"
    },
    {
      "number": 39,
      "field": "challenge_status"
    },
    {
      "number": 40,
      "field": "review_due_at"
    },
    {
      "number": 41,
      "field": "closure_state"
    },
    {
      "number": 42,
      "field": "unresolved_duty_refs"
    },
    {
      "number": 43,
      "field": "handoff_state"
    },
    {
      "number": 44,
      "field": "recipient_refs"
    },
    {
      "number": 45,
      "field": "recipient_acceptance_refs"
    },
    {
      "number": 46,
      "field": "hashes_and_signatures"
    },
    {
      "number": 47,